timestamp,title,publisher,link
2025-06-10 12:28:08+00:00,"Market Chatter: Tech Group Reportedly Pleads With Senate to Keep Clean Energy Credits, Loan Guarantees",MT Newswires,https://finance.yahoo.com/news/market-chatter-tech-group-reportedly-122808646.html
2025-06-10 11:12:19+00:00,Uber to bring self-driving cars on to Britain’s streets next year,The Telegraph,https://tech.yahoo.com/transportation/articles/uber-bring-self-driving-cars-111219346.html
2025-06-10 11:03:31+00:00,Google in Mexico faces major potential fine as antitrust ruling nears,Reuters,https://finance.yahoo.com/news/google-mexico-faces-major-potential-110331738.html
2025-06-10 10:00:48+00:00,IBM just took a 'significant' step toward useful quantum computing,Yahoo Finance,https://finance.yahoo.com/news/ibm-just-took-a-significant-step-toward-useful-quantum-computing-100048784.html
2025-06-10 09:00:00+00:00,Google CEO Sundar Pichai’s advice to young people is to work with those who outshine you,Fortune,https://finance.yahoo.com/news/google-ceo-sundar-pichai-advice-090000368.html
2025-06-10 08:00:25+00:00,"Reddit brands Anthropic as 'anything but' a white knight, heating up AI scraping wars",Yahoo Finance,https://finance.yahoo.com/news/reddit-brands-anthropic-as-anything-but-a-white-knight-heating-up-ai-scraping-wars-080025728.html
2025-06-10 00:56:00+00:00,"Want $1 Million in Retirement? Invest $100,000 in These 3 Stocks and Wait a Decade",Motley Fool,https://finance.yahoo.com/news/want-1-million-retirement-invest-005600063.html
2025-06-09 22:45:49+00:00,At least 6 Waymo autonomous vehicles have been vandalized amid anti-ICE protests in Los Angeles,Fortune,https://www.yahoo.com/news/least-6-waymo-autonomous-vehicles-224549406.html
2025-06-09 22:33:28+00:00,Waymo halts service in downtown Los Angeles amid ICE protests,LA Times,https://www.yahoo.com/news/waymo-halts-downtown-los-angeles-223328088.html
2025-06-09 22:15:00+00:00,Watch: Los Angeles Protestors Target Waymo Driverless Cars,WSJ,https://finance.yahoo.com/video/watch-los-angeles-protestors-target-221500636.html
2025-06-09 21:45:12+00:00,Alphabet (GOOGL) Laps the Stock Market: Here's Why,Zacks,https://finance.yahoo.com/news/alphabet-googl-laps-stock-market-214512390.html
2025-06-09 21:45:12+00:00,Alphabet Inc. (GOOG) Outperforms Broader Market: What You Need to Know,Zacks,https://finance.yahoo.com/news/alphabet-inc-goog-outperforms-broader-214512423.html
2025-06-09 20:49:47+00:00,Amazon wants to become a global marketplace for AI,Yahoo Finance,https://finance.yahoo.com/news/amazon-wants-to-become-a-global-marketplace-for-ai-204947448.html
2025-06-09 20:15:00+00:00,How Waymo got caught in the crossfire of Los Angeles ICE protests,FastCompany,https://finance.yahoo.com/news/waymo-got-caught-crossfire-los-201500065.html
2025-06-09 19:54:39+00:00,Apple is stuck in neutral when it comes to personal AI,FastCompany,https://finance.yahoo.com/news/apple-stuck-neutral-comes-personal-195439789.html
2025-06-09 19:42:29+00:00,Waymo robotaxis targeted for vandalism amid Los Angeles protests,Automotive News,https://www.yahoo.com/news/waymo-robotaxis-targeted-vandalism-amid-194229609.html
2025-06-09 19:30:00+00:00,"LVMH and Google Executives Talk Agentic AI, Cybersecurity and Navigating Volatility",WWD,https://finance.yahoo.com/news/lvmh-google-executives-talk-agentic-193000902.html
2025-06-09 18:57:44+00:00,Update: Market Chatter: Google's Waymo Pauses Services in Los Angeles Due to Protests,MT Newswires,https://finance.yahoo.com/news/market-chatter-google-apos-waymo-185744635.html
2025-06-09 16:05:00+00:00,Should You Buy the Dip on Reddit Stock?,Motley Fool,https://finance.yahoo.com/news/buy-dip-reddit-stock-160500368.html
2025-06-09 14:30:37+00:00,Barclays Cuts More Than 200 Investment Bank Jobs to Reduce Costs,Bloomberg,https://finance.yahoo.com/news/barclays-cuts-more-200-investment-143037110.html
2025-06-09 13:35:28+00:00,Alphabet Inc. (GOOGL): A Bull Case Theory,Insider Monkey,https://finance.yahoo.com/news/alphabet-inc-googl-bull-case-133528787.html
2025-06-09 13:30:04+00:00,New to Investing? This 1 Computer and Technology Stock Could Be the Perfect Starting Point,Zacks,https://finance.yahoo.com/news/investing-1-computer-technology-stock-133004329.html
2025-06-09 12:30:00+00:00,Do Options Traders Know Something About Alphabet Stock We Don't?,Zacks,https://finance.yahoo.com/news/options-traders-know-something-alphabet-123000969.html
2025-06-09 10:30:00+00:00,"Is Google the Cheapest ""Magnificent Seven"" Stock You Can Buy Today?",Motley Fool,https://finance.yahoo.com/news/google-cheapest-magnificent-seven-stock-103000014.html
2025-06-09 10:16:00+00:00,How to get the most out of Google’s free AI Studio,FastCompany,https://finance.yahoo.com/news/most-google-free-ai-studio-101600302.html
2025-06-09 10:05:36+00:00,Apple opens its AI to developers but keeps its broader ambitions modest,Reuters,https://finance.yahoo.com/news/wwdc-apple-faces-ai-regulatory-100536027.html
2025-06-09 08:55:00+00:00,3 Leading Tech Stocks to Buy in 2025,Motley Fool,https://finance.yahoo.com/news/3-leading-tech-stocks-buy-085500723.html
2025-06-09 07:42:00+00:00,Did Google Just Give Investors a Reason to Load Up on the Stock?,Motley Fool,https://finance.yahoo.com/news/did-google-just-investors-reason-074200105.html
2025-06-08 21:59:20+00:00,Meta Set to Throw Billions at Startup That Leads AI Data Market,Bloomberg,https://finance.yahoo.com/news/meta-set-throw-billions-startup-215920387.html
2025-06-08 16:37:26+00:00,Meta in Talks for Scale AI Investment That Could Top $10 Billion,Bloomberg,https://finance.yahoo.com/news/meta-talks-scale-ai-investment-053458408.html
2025-06-08 12:00:46+00:00,Why the tech trade is still 'alive and well',Yahoo Finance Video,https://finance.yahoo.com/video/why-tech-trade-still-alive-120046632.html
2025-06-08 09:40:00+00:00,Warren Buffett Might Not Own These Artificial Intelligence (AI) Stocks -- but Their Fundamentals Check Out,Motley Fool,https://finance.yahoo.com/news/warren-buffett-might-not-own-094000976.html
2025-06-08 09:00:03+00:00,Apple is about to answer a burning question about its future,CNN Business,https://tech.yahoo.com/ai/articles/apple-answer-burning-future-090003417.html
2025-06-08 08:35:00+00:00,Value Meets Growth: 3 Artificial Intelligence (AI) Stocks Even Warren Buffett Might Respect,Motley Fool,https://finance.yahoo.com/news/value-meets-growth-3-artificial-083500364.html
2025-06-08 08:25:00+00:00,"Nvidia Stock: Forget AI Data Centers, Is This Market Nvidia's Next Big Growth Driver?",Motley Fool,https://finance.yahoo.com/news/nvidia-stock-forget-ai-data-082500772.html
2025-06-07 20:00:00+00:00,"Got $3,000? 1 Artificial Intelligence (AI) Stock to Buy and Hold for the Long Term.",Motley Fool,https://finance.yahoo.com/news/got-3-000-1-artificial-200000183.html
2025-06-07 14:20:21+00:00,"WWDC to focus on redesigns as Apple remains sidelined on AI, Bloomberg says",TipRanks,https://tech.yahoo.com/ai/articles/wwdc-focus-redesigns-apple-remains-142021566.html
2025-06-07 10:00:02+00:00,Barclays sees rising regulatory risk for Google as antitrust case nears ruling,Investing.com,https://finance.yahoo.com/news/barclays-sees-rising-regulatory-risk-100002969.html
2025-06-07 09:00:00+00:00,3 No-Brainer Artificial Intelligence (AI) Stocks to Buy on the Dip,Motley Fool,https://finance.yahoo.com/news/3-no-brainer-artificial-intelligence-090000361.html
2025-06-07 07:50:00+00:00,"2 Artificial Intelligence (AI) Stocks to Buy Before They Soar to $3 Trillion, According to Certain Wall Street Analysts",Motley Fool,https://finance.yahoo.com/news/2-artificial-intelligence-ai-stocks-075000392.html
2025-06-07 02:03:00+00:00,Analysts unveil bold forecast for Alphabet stock despite ChatGPT threat,TheStreet,https://finance.yahoo.com/news/analysts-unveil-bold-forecast-alphabet-020300111.html
2025-06-06 20:29:56+00:00,Why Alphabet (GOOGL) Stock Is Trading Up Today,StockStory,https://finance.yahoo.com/news/why-alphabet-googl-stock-trading-202956548.html
2025-06-06 17:17:41+00:00,"Apple, Google, Airbnb, and X are reportedly eyeing stablecoin payments",TheStreet,https://finance.yahoo.com/news/apple-google-airbnb-x-reportedly-171741288.html
2025-06-06 16:47:33+00:00,AI Search Engine Perplexity Gains Traction vs. Google,GuruFocus.com,https://finance.yahoo.com/news/ai-search-engine-perplexity-gains-164733390.html
2025-06-06 15:30:55+00:00,Why Is Zillow (Z) Up 2.8% Since Last Earnings Report?,Zacks,https://finance.yahoo.com/news/why-zillow-z-2-8-153055311.html
2025-06-06 14:15:46+00:00,Alphabet Inc. (GOOGL): Jim Cramer Reveals Big AI Feature That “Saved” The Company,Insider Monkey,https://finance.yahoo.com/news/alphabet-inc-googl-jim-cramer-141546238.html
2025-06-06 14:08:00+00:00,Can Alphabet's AI Innovation Help Google Search Regain Market Share?,Zacks,https://finance.yahoo.com/news/alphabets-ai-innovation-help-google-140800602.html
2025-06-06 13:48:00+00:00,Implied Volatility Surging for Alphabet Stock Options,Zacks,https://finance.yahoo.com/news/implied-volatility-surging-alphabet-stock-134800554.html
2025-06-06 13:00:05+00:00,What to expect from Apple's WWDC event as Wall Street looks for AI gains,Yahoo Finance,https://finance.yahoo.com/news/what-to-expect-from-apples-wwdc-event-as-wall-street-looks-for-ai-gains-130005429.html
2025-06-06 12:46:27+00:00,"Apple, X, and Airbnb among growing number of Big Tech firms exploring crypto adoption",Fortune,https://finance.yahoo.com/news/apple-x-airbnb-among-growing-124627298.html
2025-06-06 12:38:01+00:00,Cloud AI Update - Transforming Unstructured Data Integration with AI-Driven Solutions,Simply Wall St.,https://finance.yahoo.com/news/cloud-ai-transforming-unstructured-data-123801401.html
2025-06-06 12:32:00+00:00,"Prediction: This ""Magnificent Seven"" Growth Stock Will Hit an All-Time in June. Here's Why It's Worth Buying Now.",Motley Fool,https://finance.yahoo.com/news/prediction-magnificent-seven-growth-stock-123200464.html
