timestamp,title,publisher,link
2025-06-16 20:15:09+00:00,TikTok will go dark June 19 unless Trump gives it another lifeline,Yahoo Finance,https://finance.yahoo.com/news/tiktok-will-go-dark-june-19-unless-trump-gives-it-another-lifeline-201509054.html
2025-06-16 20:00:48+00:00,Why Alphabet's AI Infrastructure Makes Today's Price a Bargain,GuruFocus.com,https://finance.yahoo.com/news/why-alphabets-ai-infrastructure-makes-200048235.html
2025-06-16 15:52:19+00:00,Alphabet's (GOOGL) $32B Wiz Deal Faces DOJ Antitrust Hurdles,GuruFocus.com,https://finance.yahoo.com/news/alphabets-googl-32b-wiz-deal-155219016.html
2025-06-16 15:42:33+00:00,Update: Market Chatter: Google to Cut Ties With Scale AI After Meta Platforms Deal,MT Newswires,https://finance.yahoo.com/news/market-chatter-google-cut-ties-154233462.html
2025-06-16 14:01:26+00:00,Google's $32 Billion Wiz Deal Lands Under DOJ Lens,GuruFocus.com,https://finance.yahoo.com/news/googles-32-billion-wiz-deal-140126623.html
2025-06-16 13:41:26+00:00,Meta Investors Cheer as Zuckerberg Doubles Down on AI Commitment,Bloomberg,https://finance.yahoo.com/news/meta-investors-cheer-zuckerberg-doubles-101644156.html
2025-06-16 13:30:00+00:00,Prediction: This Artificial Intelligence (AI) Stock Will Lead the Next Tech Bull Market,Motley Fool,https://finance.yahoo.com/news/prediction-artificial-intelligence-ai-stock-133000808.html
2025-06-16 13:16:31+00:00,Market Chatter: Google Plans to Exit From Scale AI After Meta Platforms Deal,MT Newswires,https://finance.yahoo.com/news/market-chatter-google-plans-exit-131631756.html
2025-06-16 12:32:22+00:00,"Google (GOOGL) Resolves Global Outage That Disrupted Gmail, Cloud, and Partner Apps",GuruFocus.com,https://www.yahoo.com/news/google-googl-resolves-global-outage-123222760.html
2025-06-16 11:50:39+00:00,Term Sheet Next: How Facebook’s former chief revenue officer is coaching the next generation of startup founders,Fortune,https://finance.yahoo.com/news/term-sheet-next-facebook-former-115039212.html
2025-06-16 11:21:52+00:00,"OpenAI plans to continue working with Scale AI despite rival Meta’s $14.3 billion deal with the company, OpenAI’s CFO says",Fortune,https://finance.yahoo.com/news/openai-plans-continue-working-scale-112152230.html
2025-06-16 10:59:46+00:00,Google to terminate Scale AI partnership,Verdict,https://finance.yahoo.com/news/google-terminate-scale-ai-partnership-105946983.html
2025-06-16 09:30:00+00:00,Big Tech’s Furious Rally Forces Options Pros to Line Up Hedges,Bloomberg,https://finance.yahoo.com/news/big-tech-furious-rally-forces-093000399.html
2025-06-16 09:15:00+00:00,"The Best Stocks to Buy With $1,000 Right Now",Motley Fool,https://finance.yahoo.com/news/best-stocks-buy-1-000-091500394.html
2025-06-16 07:27:54+00:00,Adnoc Makes $19 Billion Takeover Bid for Australia’s Santos,Bloomberg,https://finance.yahoo.com/news/adnoc-makes-19-billion-takeover-015430686.html
2025-06-15 22:19:00+00:00,"3 Top Stocks I Wouldn't Hesitate to Invest $1,000 in Right Now",Motley Fool,https://finance.yahoo.com/news/3-top-stocks-wouldnt-hesitate-221900526.html
2025-06-15 20:00:00+00:00,"Australians Equally Distrust Both Trump and Xi, Survey Finds",Bloomberg,https://finance.yahoo.com/news/australians-equally-distrust-both-trump-200000826.html
2025-06-15 14:17:00+00:00,So your company offered you a buyout. Should you take it? Here’s what to know.,MarketWatch,https://finance.yahoo.com/news/company-offered-buyout-know-140000174.html
2025-06-15 13:45:00+00:00,2 Top Tech Stocks That Could Help Make You a Millionaire,Motley Fool,https://finance.yahoo.com/news/2-top-tech-stocks-could-134500618.html
2025-06-15 09:49:00+00:00,Warren Buffett Has $90 Billion Invested in These 9 Artificial Intelligence (AI) Stocks. Here's the Best of the Bunch.,Motley Fool,https://finance.yahoo.com/news/warren-buffett-90-billion-invested-094900730.html
2025-06-15 09:47:37+00:00,Potential Alphabet (GOOGL) and OpenAI Deal Could Shift Dynamics in AI Race,Insider Monkey,https://finance.yahoo.com/news/potential-alphabet-googl-openai-deal-094737884.html
2025-06-15 08:45:00+00:00,2 Artificial Intelligence (AI) Cloud Stocks to Buy in June,Motley Fool,https://finance.yahoo.com/news/2-artificial-intelligence-ai-cloud-084500808.html
2025-06-15 00:31:00+00:00,Oracle Stock (ORCL) Delivers Strong Quarter as Cloud and AI Strategy Pays Off,TipRanks,https://finance.yahoo.com/news/oracle-stock-orcl-delivers-strong-003100909.html
2025-06-14 22:00:00+00:00,"The ""Magnificent Seven"" Are Still Growing Faster Than the Rest of the S&P 500. Here's When That Could Change, According to Wall Street Analysts.",Motley Fool,https://finance.yahoo.com/news/magnificent-seven-still-growing-faster-220000180.html
2025-06-14 20:09:00+00:00,Billionaire Bill Ackman Just Joined Warren Buffett and Cathie Wood by Adding This Monster Artificial Intelligence (AI) Stock to His Portfolio,Motley Fool,https://finance.yahoo.com/news/billionaire-bill-ackman-just-joined-200900330.html
2025-06-14 18:46:54+00:00,Google reportedly plans to cut ties with Scale AI,TechCrunch,https://finance.yahoo.com/news/google-reportedly-plans-cut-ties-184654488.html
2025-06-14 17:08:00+00:00,Week in Review: WWDC 2025 recap,TechCrunch,https://finance.yahoo.com/news/week-review-wwdc-2025-recap-170800689.html
2025-06-14 09:55:00+00:00,3 No-Brainer Artificial Intelligence (AI) Growth Stocks to Buy With $200 Right Now,Motley Fool,https://finance.yahoo.com/news/3-no-brainer-artificial-intelligence-095500655.html
2025-06-14 09:00:07+00:00,"Google, Meta and Snap think this tech is the next big thing",CNN Business,https://tech.yahoo.com/ar-vr/articles/google-meta-snap-think-tech-090007903.html
2025-06-14 08:30:00+00:00,3 Magnificent S&P 500 Dividend Stocks Down 15% to 65% to Buy and Hold Forever,Motley Fool,https://finance.yahoo.com/news/3-magnificent-p-500-dividend-083000955.html
2025-06-14 08:20:00+00:00,Should You Forget Nvidia and Buy These 2 Artificial Intelligence (AI) Stocks Instead?,Motley Fool,https://finance.yahoo.com/news/forget-nvidia-buy-2-artificial-082000561.html
2025-06-14 07:25:00+00:00,Prediction: This Quantum Computing Stock Will Surge in 2025,Motley Fool,https://finance.yahoo.com/news/prediction-quantum-computing-stock-surge-072500394.html
2025-06-14 05:00:05+00:00,The Briton who invented Amazon's Alexa is now helping to make AI trustworthy,Yahoo Finance UK,https://finance.yahoo.com/news/amazon-alexa-echo-ai-william-tunstall-pedoe-050005378.html
2025-06-13 23:13:27+00:00,Google comes out on top as years-long Mexico antitrust case closed,Reuters,https://finance.yahoo.com/news/google-comes-top-years-long-231327495.html
2025-06-13 21:59:26+00:00,Meta's $14.8 billion Scale AI deal latest test of AI partnerships,Reuters,https://finance.yahoo.com/news/analysis-metas-14-8-billion-215926560.html
2025-06-13 21:33:30+00:00,"Exclusive-Google, Scale AI's largest customer, plans split after Meta deal, sources say",Reuters,https://finance.yahoo.com/news/exclusive-google-scale-ais-largest-213330555.html
2025-06-13 18:45:00+00:00,TechCrunch Mobility: The cost of Waymo,TechCrunch,https://finance.yahoo.com/news/techcrunch-mobility-cost-waymo-184500051.html
2025-06-13 18:01:33+00:00,Google tests Audio Overviews for Search queries,TechCrunch,https://finance.yahoo.com/news/google-tests-audio-overviews-search-180133726.html
2025-06-13 17:33:00+00:00,Tesla rival gets good news as robotaxi launch looms,TheStreet,https://finance.yahoo.com/news/tesla-rival-gets-good-news-173300303.html
2025-06-13 17:31:38+00:00,"Rates Of Hallucination In AI Models From Google, OpenAI On The Rise",Benzinga,https://finance.yahoo.com/news/rates-hallucination-ai-models-google-173138158.html
2025-06-13 16:40:08+00:00,"Nvidia, Amazon, Google Lead Tech Selloff After Israel Strikes Iran",GuruFocus.com,https://finance.yahoo.com/news/nvidia-amazon-google-lead-tech-164008243.html
2025-06-13 16:36:10+00:00,"Internet outages show signs of recovery as Spotify, Google and other popular online services are down for thousands of users",CNN Business,https://www.yahoo.com/news/internet-outages-show-signs-recovery-202506504.html
2025-06-13 16:13:00+00:00,Does Rivian's AI-Driven RAP Provide It a Competitive Edge?,Zacks,https://finance.yahoo.com/news/does-rivians-ai-driven-rap-161300660.html
2025-06-13 15:40:30+00:00,Market Chatter: Google Fights Brazil Court Order in US Lawsuit Against LATAM Airlines,MT Newswires,https://finance.yahoo.com/news/market-chatter-google-fights-brazil-154030614.html
2025-06-13 14:53:01+00:00,Update: UK Regulator Mulls Releasing Google From Privacy Sandbox Commitments,MT Newswires,https://finance.yahoo.com/news/uk-regulator-mulls-releasing-google-145301963.html
2025-06-13 14:43:00+00:00,"QBTS Soars Over 1,300% Despite IBM and GOOGL's Quantum Milestones",Zacks,https://finance.yahoo.com/news/qbts-soars-over-1-300-144300040.html
2025-06-13 13:00:04+00:00,Investors Heavily Search Alphabet Inc. (GOOGL): Here is What You Need to Know,Zacks,https://finance.yahoo.com/news/investors-heavily-search-alphabet-inc-130004013.html
2025-06-13 13:00:02+00:00,Here is What to Know Beyond Why Alphabet Inc. (GOOG) is a Trending Stock,Zacks,https://finance.yahoo.com/news/know-beyond-why-alphabet-inc-130002021.html
2025-06-13 12:41:49+00:00,Britain says Google's online-ad commitments no longer needed,Reuters,https://tech.yahoo.com/business/articles/britain-says-googles-online-ad-124149241.html
2025-06-13 12:38:09+00:00,Cloud AI Update - Cloud Computing's Transformative Growth and Future Opportunities,Simply Wall St.,https://finance.yahoo.com/news/cloud-ai-cloud-computings-transformative-123809200.html
2025-06-13 11:47:00+00:00,"Company News for Jun 13, 2025",Zacks,https://finance.yahoo.com/news/company-news-jun-13-2025-114700737.html
2025-06-13 11:23:00+00:00,Should You Buy Polkadot While It's Under $5?,Motley Fool,https://finance.yahoo.com/news/buy-polkadot-while-under-5-112300879.html
2025-06-13 10:46:11+00:00,"IBM, Google Emerge As Top Investors In Quantum Computing With Most Patents Issued In 2025: 'Only Two Companies Seriously Investing,' Says Martin Shkreli",Benzinga,https://finance.yahoo.com/news/ibm-google-emerge-top-investors-104611410.html
2025-06-13 10:00:42+00:00,The 2025 stock market rally is about more than just the 'Magnificent 7': Morning Brief,Yahoo Finance,https://finance.yahoo.com/news/the-2025-stock-market-rally-is-about-more-than-just-the-magnificent-7-morning-brief-100042029.html
2025-06-13 09:36:00+00:00,2 Top Tech Stocks to Buy Right Now,Motley Fool,https://finance.yahoo.com/news/2-top-tech-stocks-buy-093600099.html
2025-06-13 09:30:00+00:00,Better Quantum Computing Stock: Rigetti Computing or IonQ?,Motley Fool,https://finance.yahoo.com/news/better-quantum-computing-stock-rigetti-093000313.html
2025-06-13 09:00:19+00:00,How Waymo got the edge on the competition and Tesla's robotaxi (so far),Yahoo Finance,https://finance.yahoo.com/news/how-waymo-got-the-edge-on-the-competition-and-teslas-robotaxi-so-far-090019552.html
2025-06-13 08:35:00+00:00,5 No-Brainer Artificial intelligence (AI) Stocks to Buy Right Now,Motley Fool,https://finance.yahoo.com/news/5-no-brainer-artificial-intelligence-083500592.html
2025-06-13 07:59:00+00:00,2 Brilliant Growth Stocks to Buy Now and Hold for the Long Term,Motley Fool,https://finance.yahoo.com/news/2-brilliant-growth-stocks-buy-075900527.html
2025-06-13 03:11:01+00:00,Alphabet (GOOGL) Reaffirmed as ‘Overweight’ by Morgan Stanley as Google Appoints New Chief AI Architect,Insider Monkey,https://finance.yahoo.com/news/alphabet-googl-reaffirmed-overweight-morgan-031101853.html
2025-06-13 01:40:12+00:00,Meta invests $14.3B in AI firm Scale and recruits its CEO for 'superintelligence' team,Associated Press Finance,https://finance.yahoo.com/news/meta-invests-ai-firm-scale-014012442.html
2025-06-13 01:30:38+00:00,"Meta Finalizes $14.3 Billion Scale Investment, Hires Its CEO",Bloomberg,https://finance.yahoo.com/news/meta-finalizes-14-3-billion-013038158.html
2025-06-12 21:27:31+00:00,Massive Google Cloud outage disrupts popular internet services,Associated Press Finance,https://www.yahoo.com/news/massive-google-cloud-outage-disrupts-212731272.html
2025-06-12 20:56:20+00:00,Google sues LATAM Airlines in US over Brazilian YouTube video dispute,Reuters,https://www.yahoo.com/news/google-sues-latam-airlines-us-205620265.html
2025-06-12 20:45:31+00:00,Apple Targets Spring 2026 for Release of Delayed Siri AI Upgrade,Bloomberg,https://finance.yahoo.com/news/apple-targets-spring-2026-release-204531105.html
2025-06-12 19:45:47+00:00,Amazon Preps Bedrock Overhaul to Challenge Vertex AI,GuruFocus.com,https://finance.yahoo.com/news/amazon-preps-bedrock-overhaul-challenge-194547788.html
2025-06-12 16:16:57+00:00,"Roblox Poised for 'Record-Breaking' Q2 Driven by Grow a Garden Game, Wedbush Says",MT Newswires,https://finance.yahoo.com/news/roblox-poised-apos-record-breaking-161657191.html
2025-06-12 15:49:00+00:00,Pixel Gets New Features and Android 16: Should You Hold GOOGL Stock?,Zacks,https://finance.yahoo.com/news/pixel-gets-features-android-16-154900081.html
2025-06-12 15:05:05+00:00,'Mag 7' turned 'Mid 7': Is 2025 the end of tech dominance?,Yahoo Finance Video,https://finance.yahoo.com/video/mag-7-turned-mid-7-150505452.html
2025-06-12 14:39:38+00:00,"Adobe, Uber and Dick's, CoreWeave-Google: Trending Tickers",Yahoo Finance Video,https://finance.yahoo.com/video/adobe-uber-dicks-coreweave-google-143938231.html
2025-06-12 13:35:23+00:00,CoreWeave Shorts Face 150% Borrow Costs After $1.6 Billion Loss,Bloomberg,https://finance.yahoo.com/news/coreweave-shorts-face-150-borrow-133523404.html
2025-06-12 13:30:25+00:00,Quantum stocks higher as Nvidia CEO sees ‘inflection point’,TipRanks,https://finance.yahoo.com/news/quantum-stocks-higher-nvidia-ceo-133025964.html
2025-06-12 13:16:00+00:00,"The Zacks Analyst Blog Highlights Tesla, Alphabet and Baidu",Zacks,https://finance.yahoo.com/news/zacks-analyst-blog-highlights-tesla-131600230.html
2025-06-12 13:13:00+00:00,"The Zacks Analyst Blog Highlights Apple, Amazon, Microsoft and Alphabet",Zacks,https://finance.yahoo.com/news/zacks-analyst-blog-highlights-apple-131300813.html
2025-06-12 13:06:00+00:00,"The Zacks Analyst Blog Highlights AppLovin, Alphabet, Meta Platforms, Microsoft and Salesforce",Zacks,https://finance.yahoo.com/news/zacks-analyst-blog-highlights-applovin-130600180.html
2025-06-12 12:01:04+00:00,‘This is coming for everyone’: A new kind of AI bot takes over the web,Washington Post,https://www.yahoo.com/news/coming-everyone-kind-ai-bot-120104499.html
2025-06-12 12:00:00+00:00,Waymo rides cost more than Uber or Lyft — and people are paying anyway,TechCrunch,https://finance.yahoo.com/news/waymo-rides-cost-more-uber-120000828.html
2025-06-12 11:15:00+00:00,"If I Could Only Buy and Hold a Single Stock, This Would Be It.",Motley Fool,https://finance.yahoo.com/news/could-only-buy-hold-single-111500794.html
2025-06-12 11:10:08+00:00,Market Chatter: CoreWeave to Offer Compute Capacity in Google-OpenAI Cloud Deal,MT Newswires,https://finance.yahoo.com/news/market-chatter-coreweave-offer-compute-111008859.html
2025-06-12 11:00:00+00:00,4 Dividend Stocks to Double Up on Right Now,Motley Fool,https://finance.yahoo.com/news/4-dividend-stocks-double-now-110000480.html
2025-06-12 10:07:21+00:00,"Ericsson, Google Cloud Launch New Tool To Help Telecoms Build Faster, Smarter Networks",Benzinga,https://finance.yahoo.com/news/ericsson-google-cloud-launch-tool-100721736.html
2025-06-12 09:35:00+00:00,1 Artificial Intelligence (AI) Stock That Could Set You Up for Life,Motley Fool,https://finance.yahoo.com/news/1-artificial-intelligence-ai-stock-093500675.html
2025-06-12 08:30:00+00:00,Don't Miss This Incredible Opportunity: 1 Growth Stock Down 48% to Buy Now,Motley Fool,https://finance.yahoo.com/news/dont-miss-incredible-opportunity-1-083000095.html
2025-06-12 08:12:00+00:00,"If I Could Invest $1,000 in Any Growth Stock, It Would Be This One",Motley Fool,https://finance.yahoo.com/news/could-invest-1-000-growth-081200555.html
2025-06-12 04:00:00+00:00,AP Top Extended Financial Headlines at 11:19 p.m. EDT,Associated Press Finance,https://finance.yahoo.com/news/ap-top-extended-financial-headlines-040000433.html
2025-06-12 04:00:00+00:00,AP Top Financial News at 11:19 p.m. EDT,Associated Press Finance,https://finance.yahoo.com/news/ap-top-financial-news-12-040000954.html
2025-06-12 00:17:32+00:00,"Nvidia, Samsung Plan Investments in Robotics Startup Skild AI",Bloomberg,https://finance.yahoo.com/news/nvidia-samsung-plan-investments-robotics-001732590.html
2025-06-11 23:31:28+00:00,Google Expands Buyouts In Search And Ads Division As AI  Reshapes Priorities,Benzinga,https://finance.yahoo.com/news/google-expands-buyouts-search-ads-233128996.html
2025-06-11 21:30:57+00:00,"Google Buyouts Could Point to More Tech Layoffs, as Sector Faces Heavy Job Losses",Investopedia,https://finance.yahoo.com/news/google-buyouts-could-point-more-213057759.html
2025-06-11 20:46:04+00:00,Alphabet (GOOGL) Lands Surprise Win as OpenAI Picks Google Cloud for AI Expansion,Insider Monkey,https://finance.yahoo.com/news/alphabet-googl-lands-surprise-win-204604342.html
2025-06-11 20:35:05+00:00,CoreWeave reportedly a key player in Google-OpenAI partnership,Investing.com,https://finance.yahoo.com/news/coreweave-reportedly-key-player-google-203505305.html
2025-06-11 20:01:43+00:00,"CoreWeave to offer compute capacity in Google's new cloud deal with OpenAI, sources say",Reuters,https://finance.yahoo.com/news/coreweave-offer-compute-capacity-googles-200143761.html
2025-06-11 19:03:06+00:00,‘Classic Apple': Why Apple is taking the slow road with AI,Yahoo Finance,https://finance.yahoo.com/news/classic-apple-why-apple-is-taking-the-slow-road-with-ai-190306633.html
2025-06-11 18:34:30+00:00,Google names insider Kavukcuoglu to lead AI-powered product development,Reuters,https://finance.yahoo.com/news/google-names-insider-kavukcuoglu-lead-183430519.html
2025-06-11 16:35:00+00:00,AppLovin Stock Jumps 50% in 3 Months: Is it Too Late to Buy?,Zacks,https://finance.yahoo.com/news/applovin-stock-jumps-50-3-163500024.html
2025-06-11 16:30:03+00:00,Musk Pins Tesla's Comeback on Robotaxis After Retreat From Feud,Bloomberg,https://finance.yahoo.com/news/musk-pins-teslas-comeback-robotaxis-163003657.html
2025-06-11 15:19:00+00:00,These Artificial Intelligence (AI) Stocks Could Appeal to Warren Buffett-Style Investors,Motley Fool,https://finance.yahoo.com/news/artificial-intelligence-ai-stocks-could-151900403.html
2025-06-11 15:16:37+00:00,"After Google, Meta loses public policy head in India",TechCrunch,https://www.yahoo.com/news/google-meta-loses-public-policy-151637201.html
2025-06-11 14:08:59+00:00,AI Bets That Fueled Big Tech’s Surge Now Threaten Rich Profits,Bloomberg,https://finance.yahoo.com/news/ai-bets-fueled-big-tech-104111225.html
2025-06-11 14:07:09+00:00,Google Cloud-OpenAI deal signals confidence in long-term search position: MS,Investing.com,https://finance.yahoo.com/news/google-cloud-openai-deal-signals-140709032.html
2025-06-11 14:07:00+00:00,Google buyouts are being offered to employees on search and other teams as shift to AI ramps up,FastCompany,https://finance.yahoo.com/news/google-buyouts-being-offered-employees-140700321.html
2025-06-11 14:05:21+00:00,Update: Market Chatter: Google Set to Face Mexico Antitrust Regulator Ruling by Next Week,MT Newswires,https://finance.yahoo.com/news/market-chatter-google-set-face-140521860.html
2025-06-11 13:55:26+00:00,"Google selected by OpenAI for cloud deal, Reuters reports",TipRanks,https://finance.yahoo.com/news/google-selected-openai-cloud-deal-135526375.html
2025-06-11 13:49:00+00:00,Can Cloudflare's Workers Platform Lead Its Next Phase of Growth?,Zacks,https://finance.yahoo.com/news/cloudflares-workers-platform-lead-next-134900938.html
2025-06-11 13:33:00+00:00,Tesla's Robotaxi Launch is Almost Here But Can It Actually Deliver?,Zacks,https://finance.yahoo.com/news/teslas-robotaxi-launch-almost-actually-133300050.html
2025-06-11 13:19:42+00:00,MGNI Q1 Earnings Call: Product Innovation and Google Antitrust Developments Shape Outlook,StockStory,https://finance.yahoo.com/news/mgni-q1-earnings-call-product-131942009.html
2025-06-11 12:06:27+00:00,Google offers buyouts to more workers amid AI-driven tech upheaval and antitrust uncertainty,Associated Press Finance,https://finance.yahoo.com/news/google-offers-buyouts-staff-latest-120627655.html
2025-06-11 11:34:16+00:00,5 Things to Know Before the Stock Market Opens,Investopedia,https://finance.yahoo.com/news/5-things-know-stock-market-113416852.html
2025-06-11 10:30:00+00:00,Meta’s Scoping Out a Superintelligence Lab,The Daily Upside,https://finance.yahoo.com/news/meta-scoping-superintelligence-lab-103000841.html
2025-06-11 10:00:49+00:00,The biggest IPOs look a lot like the biggest stocks in the market: Morning Brief,Yahoo Finance,https://finance.yahoo.com/news/the-biggest-ipos-look-a-lot-like-the-biggest-stocks-in-the-market-morning-brief-100049033.html
2025-06-11 09:47:00+00:00,Goldman Sachs predicts autonomous cars will slash insurance costs by 50%—but could create headaches in figuring out fault in accidents,Fortune,https://finance.yahoo.com/news/goldman-sachs-predicts-autonomous-cars-094700491.html
2025-06-11 09:33:06+00:00,"OpenAI, Google Cloud partner to expand AI capacity",Verdict,https://finance.yahoo.com/news/openai-google-cloud-partner-expand-093306451.html
2025-06-11 09:32:00+00:00,"If I Could Own Only 1 Quantum Computing Stock, This Would Be It",Motley Fool,https://finance.yahoo.com/news/could-own-only-1-quantum-093200614.html
2025-06-11 08:33:00+00:00,"Can This Unstoppable Stock Join Microsoft, Nvidia, Apple, Amazon, Alphabet, Meta Platforms, and Tesla in the $1 Trillion Club?",Motley Fool,https://finance.yahoo.com/news/unstoppable-stock-join-microsoft-nvidia-083300551.html
2025-06-10 22:15:42+00:00,Google Is Offering Buyouts to US Employees Throughout the Company,Investopedia,https://finance.yahoo.com/news/google-offering-buyouts-us-employees-221542042.html
2025-06-10 21:02:17+00:00,"Snap CEO Evan Spiegel promises new lightweight ‘Specs’ smart glasses next year, in race to beat Meta and Google to market",Fortune,https://tech.yahoo.com/ar-vr/articles/snap-ceo-evan-spiegel-promises-210217246.html
2025-06-10 20:52:01+00:00,Waymo leads in self-driving: Can Tesla's robotaxi take its crown?,Yahoo Finance Video,https://finance.yahoo.com/video/waymo-leads-self-driving-teslas-205201635.html
2025-06-10 20:31:29+00:00,"Billionaire Marc Lore's $7B Food Startup Wonder, Backed By Google Ventures, Eyes 2028 IPO With $5B Revenue Goal And AI-Powered Superapp Plans",Benzinga,https://finance.yahoo.com/news/billionaire-marc-lores-7b-food-203129480.html
2025-06-10 20:04:29+00:00,"Google-OpenAI, Casey's stock high, Flutter fee: Trending Tickers",Yahoo Finance Video,https://finance.yahoo.com/video/google-openai-caseys-stock-high-200429239.html
2025-06-10 20:00:02+00:00,Alphabet stock pares gains on buyout offers to search and ads employees,Investing.com,https://finance.yahoo.com/news/alphabet-stock-pares-gains-buyout-200002917.html
2025-06-10 18:23:54+00:00,Why Alphabet Stock Just Popped,Motley Fool,https://finance.yahoo.com/news/why-alphabet-stock-just-popped-182354715.html
2025-06-10 18:20:30+00:00,"As Google AI Takes Over Search, News Sites Lose Clicks and Cut Jobs",GuruFocus.com,https://finance.yahoo.com/news/google-ai-takes-over-search-182030770.html
2025-06-10 18:00:00+00:00,"Google rolls out Android 16 to Pixel phones, unveils AI-powered edit suggestion for Google Photos",TechCrunch,https://finance.yahoo.com/news/google-rolls-android-16-pixel-180000708.html
2025-06-10 17:42:12+00:00,Judge rejects class action for Google privacy lawsuit,Reuters,https://www.yahoo.com/news/judge-rejects-class-action-google-174212516.html
2025-06-10 17:09:28+00:00,Alphabet Shares Climb After Reported Cloud Partnership With OpenAI,GuruFocus.com,https://finance.yahoo.com/news/alphabet-shares-climb-reported-cloud-170928331.html
2025-06-10 17:07:27+00:00,"OpenAI-Google cloud deal, metals rally, Insmed trial results",Yahoo Finance Video,https://finance.yahoo.com/video/openai-google-cloud-deal-metals-170727407.html
2025-06-10 17:02:37+00:00,"OpenAI Enlists Google Cloud for Computing Capacity in Partnership of AI Rivals, Report Says",Investopedia,https://finance.yahoo.com/news/openai-enlists-google-cloud-computing-170237913.html
2025-06-10 15:43:28+00:00,"At WWDC 2025, Apple sang developers' praises amid AI letdowns and App Store battles",TechCrunch,https://finance.yahoo.com/news/wwdc-2025-apple-sang-developers-154328456.html
2025-06-10 15:13:00+00:00,"Should You Buy, Sell, or Hold Adobe Stock Post Q2 Earnings?",Zacks,https://finance.yahoo.com/news/buy-sell-hold-adobe-stock-151300545.html
2025-06-10 14:36:10+00:00,US Deploys Marines to LA as Protests Spread to More Cities,Bloomberg,https://finance.yahoo.com/news/la-set-fourth-day-unrest-150754445.html
2025-06-10 14:21:15+00:00,OpenAI to use Google cloud service alongside Microsoft,Investing.com,https://finance.yahoo.com/news/openai-google-cloud-alongside-microsoft-142115688.html
2025-06-10 13:48:14+00:00,"Exclusive-OpenAI taps Google in unprecedented cloud deal despite AI rivalry, sources say",Reuters,https://finance.yahoo.com/news/exclusive-openai-taps-google-unprecedented-134814771.html
2025-06-10 13:07:28+00:00,Apple’s big Siri upgrade still doesn’t have a launch date. Why AI can be hard to predict,CNN Business,https://tech.yahoo.com/ai/articles/next-tech-revolution-probably-won-103003475.html
2025-06-10 12:57:34+00:00,Google’s AI search features are killing traffic to publishers,TechCrunch,https://finance.yahoo.com/news/google-ai-search-features-killing-125734462.html
